{
  "feature": "web-refactor",
  "title": "Web Dashboard 컴포넌트 리팩터링",
  "docs": {
    "plan": "plan.md",
    "adr": "adr.md"
  },
  "created": "2026-04-28",
  "updated": "2026-04-28",
  "summary": {
    "total": 22,
    "pending": 18,
    "in_progress": 0,
    "done": 3,
    "skipped": 0
  },
  "parallel_groups": [
    {
      "group": "phase2-sse-state",
      "description": "T-08 완료 후 독립적으로 병렬 진행 가능",
      "tasks": ["T-09", "T-10"]
    },
    {
      "group": "phase2-sse-state-tests",
      "description": "각 구현 완료 후 병렬 진행 가능",
      "tasks": ["T-09a", "T-10a"]
    }
  ],
  "tasks": [
    {
      "id": "T-01",
      "title": "detectAnomalies 단위 테스트",
      "file": "tasks/task-01.json",
      "status": "done",
      "type": "test",
      "phase": 0,
      "risk": "low",
      "depends_on": [],
      "parallel_with": []
    },
    {
      "id": "T-02",
      "title": "makeRequestRow 골든 스냅샷 테스트",
      "file": "tasks/task-02.json",
      "status": "done",
      "type": "test",
      "phase": 0,
      "risk": "low",
      "depends_on": ["T-01"],
      "parallel_with": []
    },
    {
      "id": "T-03",
      "title": "순수 함수 단위 테스트 (api 파라미터, formatters)",
      "file": "tasks/task-03.json",
      "status": "done",
      "type": "test",
      "phase": 0,
      "risk": "low",
      "depends_on": ["T-02"],
      "parallel_with": []
    },
    {
      "id": "T-04",
      "title": "request-types.js SSoT 생성 + 3개 파일 참조 교체",
      "file": "tasks/task-04.json",
      "status": "pending",
      "type": "refactor",
      "phase": 1,
      "risk": "low",
      "depends_on": ["T-03"],
      "parallel_with": []
    },
    {
      "id": "T-05",
      "title": "filter-bar.js 컴포넌트 추출",
      "file": "tasks/task-05.json",
      "status": "pending",
      "type": "refactor",
      "phase": 1,
      "risk": "low",
      "depends_on": ["T-04"],
      "parallel_with": []
    },
    {
      "id": "T-06",
      "title": "search-box.js 컴포넌트 추출",
      "file": "tasks/task-06.json",
      "status": "pending",
      "type": "refactor",
      "phase": 1,
      "risk": "low",
      "depends_on": ["T-05"],
      "parallel_with": []
    },
    {
      "id": "T-07",
      "title": "api.js showError 중복 제거 + toolIconHtml 참조 통일",
      "file": "tasks/task-07.json",
      "status": "pending",
      "type": "refactor",
      "phase": 1,
      "risk": "low",
      "depends_on": ["T-03"],
      "parallel_with": ["T-04", "T-05", "T-06"]
    },
    {
      "id": "T-08",
      "title": "Phase 1 회귀 검증 (6개 시나리오)",
      "file": "tasks/task-08.json",
      "status": "pending",
      "type": "test",
      "phase": 1,
      "risk": "low",
      "depends_on": ["T-06", "T-07"],
      "parallel_with": []
    },
    {
      "id": "T-09",
      "title": "sse.js 분리 (콜백 주입 방식)",
      "file": "tasks/task-09.json",
      "status": "pending",
      "type": "refactor",
      "phase": 2,
      "risk": "high",
      "depends_on": ["T-08"],
      "parallel_with": ["T-10"]
    },
    {
      "id": "T-09a",
      "title": "sse.js 단위 테스트 (MockEventSource)",
      "file": "tasks/task-09a.json",
      "status": "pending",
      "type": "test",
      "phase": 2,
      "risk": "low",
      "depends_on": ["T-09"],
      "parallel_with": ["T-10a"]
    },
    {
      "id": "T-10",
      "title": "state.js 생성 (라우팅 상태 getter/setter)",
      "file": "tasks/task-10.json",
      "status": "pending",
      "type": "refactor",
      "phase": 2,
      "risk": "low",
      "depends_on": ["T-08"],
      "parallel_with": ["T-09"]
    },
    {
      "id": "T-10a",
      "title": "state.js 단위 테스트",
      "file": "tasks/task-10a.json",
      "status": "pending",
      "type": "test",
      "phase": 2,
      "risk": "low",
      "depends_on": ["T-10"],
      "parallel_with": ["T-09a"]
    },
    {
      "id": "T-11",
      "title": "Phase 2 회귀 검증",
      "file": "tasks/task-11.json",
      "status": "pending",
      "type": "test",
      "phase": 2,
      "risk": "low",
      "depends_on": ["T-09a", "T-10a"],
      "parallel_with": []
    },
    {
      "id": "T-12",
      "title": "DefaultView 추출",
      "file": "tasks/task-12.json",
      "status": "pending",
      "type": "refactor",
      "phase": 3,
      "risk": "medium",
      "depends_on": ["T-11"],
      "parallel_with": []
    },
    {
      "id": "T-13",
      "title": "Phase 3 회귀 검증",
      "file": "tasks/task-13.json",
      "status": "pending",
      "type": "test",
      "phase": 3,
      "risk": "low",
      "depends_on": ["T-12"],
      "parallel_with": []
    },
    {
      "id": "T-14",
      "title": "DetailView 기반 추출 (selectSession + AbortController)",
      "file": "tasks/task-14.json",
      "status": "pending",
      "type": "refactor",
      "phase": 4,
      "risk": "high",
      "depends_on": ["T-13"],
      "parallel_with": []
    },
    {
      "id": "T-15a",
      "title": "events.js 이벤트 상수 SSoT 생성",
      "file": "tasks/task-15a.json",
      "status": "pending",
      "type": "refactor",
      "phase": 4,
      "risk": "low",
      "depends_on": ["T-14"],
      "parallel_with": []
    },
    {
      "id": "T-15",
      "title": "applyDetailFilter fan-out → detail:filterChanged CustomEvent",
      "file": "tasks/task-15.json",
      "status": "pending",
      "type": "refactor",
      "phase": 4,
      "risk": "medium",
      "depends_on": ["T-15a"],
      "parallel_with": []
    },
    {
      "id": "T-15b",
      "title": "CustomEvent 발행-구독 단위 테스트",
      "file": "tasks/task-15b.json",
      "status": "pending",
      "type": "test",
      "phase": 4,
      "risk": "low",
      "depends_on": ["T-15"],
      "parallel_with": []
    },
    {
      "id": "T-16",
      "title": "renderers.js 정리 (DOM 삽입 제거)",
      "file": "tasks/task-16.json",
      "status": "pending",
      "type": "refactor",
      "phase": 5,
      "risk": "high",
      "depends_on": ["T-15b"],
      "parallel_with": []
    },
    {
      "id": "T-17",
      "title": "index.html 다이어트",
      "file": "tasks/task-17.json",
      "status": "pending",
      "type": "refactor",
      "phase": 5,
      "risk": "low",
      "depends_on": ["T-16"],
      "parallel_with": []
    },
    {
      "id": "T-18",
      "title": "전체 회귀 검증",
      "file": "tasks/task-18.json",
      "status": "pending",
      "type": "test",
      "phase": 5,
      "risk": "low",
      "depends_on": ["T-17"],
      "parallel_with": []
    },
    {
      "id": "T-19",
      "title": "문서 정리 (adr.md, task.json 상태 갱신)",
      "file": "tasks/task-19.json",
      "status": "pending",
      "type": "docs",
      "phase": 5,
      "risk": "low",
      "depends_on": ["T-18"],
      "parallel_with": []
    }
  ]
}
